{"verification_id":"tst:history-verification:referencecity-s009","plan_artifact_id":"tst:plan:referencecity-plan0001","plan_version_ref":"tst:plan-version:referencecity-plan0001-v1","expected_content_digest":{"algorithm":"sha256","digest":"ad2760711d5cbd713b0f92340aa5d6158a42340dd4273ea9cb4e7bfeb4232f45","canonicalization":"RFC8785-JCS"},"exists":true,"content_digest_match":true,"provenance_intact":true,"status":"superseded","proof_edge_refs":["tst:provenance-edge:referencecity-plan0001-v2-amends-v1","tst:provenance-edge:referencecity-plan0001-v2-supersedes-v1"],"verified_at":"2030-03-09T01:00:00Z","verifier_ref":"RC:ACTOR:006","schema_version":"0.4"}